text,depressive
"Would You Keep Me Craving? 

The Tooth Fairy Will Graham Fic

Ch 6: Will is getting desperate & a time was had at the Gala. No one's calling it a good time.

""When you're ready, we can share the wine, just call me""
#Hannigram #FanFic #FicRec #ao3 #ToothFairyWill

archiveofourown.org/works/471416...",0
#WWE Fan says Chelsea Green drove Tessa Blanchard to having suicidal thoughts; she responds,0
"MAGA is going after Mike Nellis of Authentic by attacking him for his mental health struggles (about which he's been very public). This is after attacking his weight in response to organizing the White Dudes for Harris call.

Fuck these fucking people. From twitter:",0
Yes the rude interactions cured my depression and suicidal thoughts too. Miracles happen. Interaction here has been a lesson I have now learned. I am so happy I have said anything. Thank you very much. Sorry for not finding friends. Have a good one! Real good.,0
"The tragedy of #GrahamThorpes suicide is so painful for him & his loved ones.
Suicide voice is the most false of friends, convincing, undermining & manipulating.
If you, or someone you love, are dealing with suicidal thoughts....PLEASE check a wonderful FREE online support 
Stayingsafe.net
#Hope",0
"Tags: Angst, Fluff, Post-War, Insecure Kirishima, Talks of self-worth, Borderline Suicidal Thoughts (Not really but read at your own risk)

ao3 link for those that prefer that format: https://buff.ly/3TcRn6I",0
"cw: mention of suicidal thoughts
.
.
.
what’s great about being plural is that one of us can talk the other out of suicidal ideation. and then we have a good cry and listen to bon iver. and i v clearly remember how far i’ve come. i mourn the potential in my old, sad, life.
tidal.com/track/250555...",0
"TW CW: Suicidal thoughts depressive episode 

I ain't saying I want my body to shut down this night, I'm just saying if I had to choose I would want it to happen during the night",0
"And facebook knows this!

Their own research shows that 6% of teens in the US trace their suicidal thoughts to Instagram -- that's about 2 kids in every classroom. 

THAT'S INSANE. More than 1 in 20 teens want to kill themself because of instagram. 

www.bbc.com/news/technol...",0
The guy may have riches and fame but his actions show the person to be mentally weak.His psychotic episodes also may indicate suicidal thoughts if things do not go as he had them played out in his head. Pity cause the guy is in a position to do good for the less fortunate,0
"Tip: Suicidal thoughts can range from a passing idea to a fully formed plan. Some people experience them as unwanted and frightening, while others find them to be comforting. People can live with suicidal thoughts without having an intention to act on them. - @sfreedenthal.bsky.social",0
"after falling in love the same part of me which is making me miserable, sending suicidal thoughts, wanting me dead suddenly pretends to be friends",0
"of course have several sessions with your therapist first to vet that they are safe, but generally they will only admit you if you are an active danger to yourself or others. this means extreme suicidal/homicidal thoughts, psychosis to the point of not being able to distinguish reality, ect",0
"Thoughts of suicide are part of our culture, transmitted in written, spoken, visual forms. Also generated by basic logic. For #SuicidePrevention, focus should be on understanding how individuals progress into suicidal plans and behaviors, and helping prevent that #SharedFacts",0
"What?! The drugs can give you suicidal thoughts if you already have suicidal thoughts?!?! 
#r4today",0
"I’m not sure how reliable this data is but it appears that are starting to see some data that suggests Ozempic may occasionally cause severe depression, anxiety and suicidal thoughts. This appears to be prelimary data, investigating ongoing, but concerning nonetheless.",0
"One Foot In Your Bedroom, One Foot Out The Door 

•Steddie
•E
•chapter 6/?
•current word count: 98,726

archiveofourown.org/works/531287...",0
"hmmm. i dont like that it's banning gore in particular. tons of people enjoy that in dark art. i struggle with suicidal thoughts often and have characters and draw art depicting my struggle. they could easily ""ope that encouraging"" and ban hammer",0
"And he did that out of respect for what my own life has been through. I started back in college during my divorce, PTSD diagnosis due to ex-wife, suicidal thoughts (mother AND ex-wife), kid being arrested twice, client emergencies, etc.

Still pissed I only got 4 A's and a D (Calc 2 - 67) last term.",0
"#SuicidePrevention #BehavioralHealthIntegration #BHI
#mdlogix #bhworks

https://nemours.mediaroom.com/2021-07-27-In-Pandemic,-21-5-of-Teen-ER-Patients-Reported-Severe-Depression-and-7-8-,-Suicidal-Thoughts?utm_campaign=meetedgar&utm_medium=social&utm_source=meetedgar.com

#SharedFacts",0
"The Conversation: 'Black adults with long COVID report higher levels of hopelessness and suicidal thoughts − new research'

theconversation.com/black-adults...",0
"That’s remarkably healthy reprogramming, I’m glad it’s working for you!

I find with anxiety/panic attacks I need to recognise them in a similar way but often out loud for it to be effective.

The suicidal thoughts this year have been dealt better in therapy for me but different underlying cause.",0
"I was 18, a legal goddamn adult, and after promising me that everything we discussed would be confidential, my psychiatrist pulled my parents in and told them that I had expressed suicidal thoughts to her",0
"#SuicidePrevention and #Suicidality
#SuicideIdeation #SuicidePlan #SuicideAttempt

""Differentiating Between Youth with a History of Suicidal Thoughts, Plans, and...",0
"#SuicidePrevention #BehavioralHealthIntegration #BHI
#mdlogix #bhworks

https://nemours.mediaroom.com/2021-07-27-In-Pandemic,-21-5-of-Teen-ER-Patients-Reported-Severe-Depression-and-7-8-,-Suicidal-Thoughts?utm_campaign=meetedgar&utm_medium=social&utm_source=meetedgar.com

#SharedFacts",0
Shitmas hits hard this year,0
"Nope. Suicidal thoughts are back, sorry",0
"""A 2016 study of about 13,000 lawyers across 19 states showed 11.5% of practicing attorneys reported suicidal thoughts. But experts say the share of practitioners thinking about suicide is probably far higher."" https://www.law360.com/pulse/modern-lawyer/articles/1794786 We have to...",0
Hey so I went a whole ass day without suicidal intrusive thoughts can I get a w in chat,0
"No, but I did get suicidal which is why I was on them. I'm glad I didn't go through alone or I might not be here. I'm much more emotional now but being with someone helps with the other thoughts.",0
"Those 10 in particular can no longer Participate in sports. But the action is to tell every child teen young adult in the nation that they have no worth, they can't pursue dreams. We will stop you. That is chilling & it creates suicidal thoughts in people who just want to live.",0
"Probably thanks to poor sleep and dream residue clonking around my subconscious, partly due an uncomfortable realization about how I’ve handled some of my life, today’s bounced between weapons grade irritability, passive suicidal thoughts, and just wishing I had resources for talk therapy.",0
"Trans immigrants are fearful of Trump’s actions on gender identity and immigration

https://www.europesays.com/1867854/

Editor’s Note: Help is available if you or someone you know is struggling with suicidal thoughts or mental…",0
" tags for the fic 

#severance #spoilers #severancespoilers",0
"The degenerative brain disease can only be diagnosed after death. But hundreds of retired players reported symptoms linked to CTE, like depression, mood swings and suicidal thoughts.",0
"Sajid Khan reveals he had suicidal thoughts amidst career setback after MeToo: “It’s been extremely bad. I’ve been out of work, despite getting a clearance” : Bollywood News

Bollywood filmmaker Sajid Khan, who faced numerous sexual harassment allegations during the #MeToo movement in 2018, has…",0
"It is strange how meds give weird reactions. I have to take low dose everything cause I have zero tolerance for meds. They make me ill.

Hell, I had bronchitis and had suicidal thoughts on a z pack, and I am far from suicidal.",0
"Realising that I've been depressed and even dealt with suicidal thoughts for roughly half of my life by now.
Damn. Kinda miss the first half of it.",0
may apologising to ben and the end conversation. i think the last time a gmmtv series made me cry was maybe… the eclipse? where first (forgot his characters name) is expressing suicidal thoughts and also when hes outed. i hate the eclipse but i like first in it.,0
"Some even claimed I lied about being trans! The intensity of the attacks on social media and the threats MAILED to me was the last straw.

I left the church, devastated and scared. I was in pain from after-surgery recovery, and I struggled with suicidal thoughts. I wanted the harassment to end.",0
"Prof. Tom Bschor spoke on the health disparities for men, including earlier overall mortality and higher rates of completed suicides - and the need for gender-sensitive prevention strategies.",0
"Suicidal thoughts freaked me out as a kid.

I wasn’t afraid of heights; I was afraid I would throw myself over a balcony in an uncontrollable fit of morbid impulse.

I’d get butterflies when I touched the railing.

Now me & those thoughts are buds.

Some day? 

Sure.

Now?

This beer is cold tho.",0
might need to go to the hospital if the suicidal ideation doesnt get better... im at a point where i dont rly wanna 100% die anymore but my brain still avalanches me with these thoughts and im just depressed generally so... idk to keep myself safe i might need to go... ill talk abt it to therapist..,0
Do you enjoy the idea of children suffering from depression and suicidal thoughts because of a lack of access to gender affirming care and torment from far-right homophobes?,0
"#Isolation

https://www.vox.com/platform/amp/the-highlight/2019/10/30/20936636/suicide-mental-health-suicidal-thoughts-teens?utm_campaign=meetedgar&utm_medium=social&utm_source=meetedgar.com

#PersonalNetworks #SharedFacts #BehavioralHealthIntegration",0
"kinda long thread about the whole history and aftermath, and how caleb comes into place with this, feel free to mute this post if any topics below can trigger you

cw : manipulation, emotional distress, emotional cheating, codependency, implications of suicidal thoughts and physical harm",0
"the beginning of the end. by behindsugamsmile (1/1)
archiveofourown.org/works/31859698

#ynkkellareads #yoonkookau_notrated",0
Just like my therapist told me after diagnosing me with crippling depression and having suicidal thoughts for more than a year,0
"27. Last book you read

A Magical Girl Retires by Park Seolyeon

Honestly the Park Seolyeon writes is really appealing to my brain. Something about it made getting back into reading really nice, I'm almost done with it but I would trigger warning for suicidal thoughts.",0
heyhey so i had bad suicidal thoughts on sun/mon as some of yall may have seen so i just got back from a session with a therapist my friend recommended and she was really really nice so if you can donate anything to help me pay for it that will also be amazing ,0
As a child and then losing even more friends and having tons of suicidal thoughts and break downs. The past two years have been big for me in healing all of this damage and making progress in understanding myself and what I need and want in life. I hope for even more this year.,0
"Hey y'all don't forget to take time for yourself.  The fight will be here when you are rested.  Also if things get to be too much call 988, or text HOME to 741741...treat depression and suicidal thoughts as medical emergencies.",0
"The article is essentially about how I went from being suicidal to fighting against those thoughts and to a better self, mentally.",0
lying in bed feeling neglected and hurt and wishing for death because being suicidal is apparently the only response I know to negative emotions and thoughts,0
"This is absolutely terrible.

A 14-year old teen committed suicide using his father's handgun after spending months chatting to an AI bot, confessing suicidal thoughts, the chatbot possibly encouraging these (and not flagging them)

The parents filed a lawsuit, arguing Chatacter .ai is responsible.",0
"so yea i learned not every teenager has suicidal thoughts on the reg in college

me and my friends are just nepo babies of mental illness",0
"tw: suicidal thoughts / mental health 
i think it’s just wild how this year has gone. I have bipolar and in September i tried to do something really scary and really permanent. i went on a LOA, spent some time in the psych ward and a partial hospitalization program.",0
Well I’m glad that you can at least type.  Can’t tell you that what you’re going to see on here is going to help with the suicidal thoughts though ,0
"You are not your mental illness.
You are not your addiction.
You are not your suicidal thoughts.

You are worth so much more ",0
"I feel the only real NPC is Angela. She, like James, came to Silent Hill to find her mother. However, the town corrupted her into the embodiment of James's depression and suicidal thoughts.

It's why only her history of child abuse is made manifest, when no other NPC has their trauma manifest.",0
"What is the point of therapy in generalif when you tell the psychologist that you are having active suicidal thoughts their first solution is to lock you up??

Thats gonna make me want to attempt against my integrity even more ",0
"And to those who have fought through suicidal thoughts, made progress in their recovery, or are still battling their demons, we say: we see you, we hear you, and we are PROUD of you. 

Your existence is a victory, no matter what your journey may look like.",0
Suicidal thoughts going crazy this past few days which is insane. I should be good for at least half a month before PMS hits me like a train. Not fair.,0
rlly annoying how there ppl who get depression with suicidal thoughts but then they get better and it just goes away like what,0
Didn’t have suicidal thoughts for the first time in years on my bingo card for the trip but here we are.,0
"Meghan, Duchess of Sussex, says speaking out about suicidal thoughts is part of ‘healing process’ - CNN http://dlvr.it/TBWmsp",0
Akinator digging through my suicidal thoughts to find what stupid obscure cartoon character I'm thinking of.,0
"If you deal with depression or suicidal thoughts

Just know that the world is better with you in it. We need you to help us fight for a better tomorrow 

Brush your teeth. Take that shower. Take care of yourself. I *know* how hard that is believe me, but that doesn't mean it's not gonna help.",0
"@Reuters: The US Food and Drug Administration received more than 250 reports of patients experiencing suicidal thoughts or behaviors while taking Ozempic or similar medicines since 2010, @Reuters found in an examination of the FDA's adverse-event database https://t.co/dqWPbxfTIn https://t.co/gbIl5FM",0
"Thoughts of suicide are part of our culture, transmitted in written, spoken, visual forms. Also generated by basic logic. For #SuicidePrevention, focus should be on understanding how individuals progress into suicidal plans and behaviors, and helping prevent that #SharedFacts'",0
"#SuicidePrevention #BehavioralHealthIntegration #BHI

https://nemours.mediaroom.com/2021-07-27-In-Pandemic,-21-5-of-Teen-ER-Patients-Reported-Severe-Depression-and-7-8-,-Suicidal-Thoughts?utm_campaign=meetedgar&utm_medium=social&utm_source=meetedgar.com

#SharedFacts",0
"Zuck is a bizarre villain of our times. Fighting the child protection bill to limit cyber bullying and suicidal thoughts amongst young people?

Who does this? For money. Always more money.",0
"Depression:
-severe low mood
-suicidal
-under or over sleeping
-poor concentration
-lack of motivation 
-feeling empty
-loss of interest
-self harming thoughts or actions
-feeling worthless
-feeling like a failure 
-under or over eating

8/",0
And I just feel like ending it so bad because of the way people treat me I try to be a good person but all people do is hurt me. I get attached to someone they replace me. I’m tired of this world and the people inside it. I really am. These past few days I’ve been really suicidal. And I had thoughts,0
"[Depression]

Oof, here come the suicidal thoughts. Let’s try turning the human off and back on again, goodnight!

(I’m safe, just not enjoying the inside of my brain)",0
"Okay, gonna post it like this, so everyone gets to see: Here's a little snippet of my evil durge (aka Daire) x Astarion writing!

CW for suicidal thoughts and this is also the start of a sex scene",0
I have also had suicidal thoughts partially because of dysphoria and lack of trans healthcare. We are in a war here. A war for our existence. And we are losing...,0
Suicidal thoughts? ,0
"The fuck you mean ""great again"" you worthless muskrat? You act like Nintendo, indie games, JRPGs, etc. don't exist anymore.

Your trans daughter is better than you in every conceivable way fuckface. Get fucked by a pig until it calls you an incel, which ideally should give you suicidal thoughts.",0
"This morning, I've been exposed to suicidal thoughts and anti-Irish racism in my feed. I will have to be a bit more selective about who I follow. I also cannot have sexually explicit posts in my feed because I sometimes access my feed in sensitive buildings.",0
"sorta backwards, society being like that is why he exists, persona gods tend to literally just be the manifestation of an aspect of humanity

Nyx is suicidal thoughts and beliefs
Izanami is the tendancy to believe whatever you're told without looking deeper
Nyarlathotep is [Every Negative Emotion]",0
"I've finally decided to take my medicine this morning after going two days without Vyvanse and Sertraline.

No more getting distracted and no more intrusive suicidal thoughts. 

Today's gonna be alright!",0
"Listen.

I understand the impulse, I do.

But if you have suicidal thoughts, it's better to not. And you know what? A community can't all be fighters. We need healers, we need storytellers, we need organizers, we need cooks, we need craftspeople.

You don't have to have a gun to build community.",0
"Remember how I said my little sister was a source of happiness, comfort, and safety? Well not fucking anymore, because the night of the election when I was having suicidal thoughts, she texted me saying: ""I hope tr*mp wins""

",0
"On that same note, I wanna recommend the Kamisu Reina series, I love how it personifies suicidal thoughts and each person's differing reasons for pursuing the end of their existence in a more real, human way (ironic since it portrays said act as being supernatural coercion rather than self but ok)",0
ZERO suicidal thoughts. NO access to unregistered weapons. I am NOT a danger to myself or others.,0
"oh hey cool got multiple slides preaching the benefits of an AI algorithm to find suicidal thoughts by monitoring students’ communications in the middle of this training module, I’m sure that’s a real good idea and not at all something that’s going to make me mash the “fuck you” feedback button",0
"It’s World Suicide Prevention Day. If you struggle with suicidal ideation, call 988. 

I chose writing as my outlet while suffering from mental illness and managed to muster up the strength to turn my thoughts into poetry.  

“Harnessing Darkness” is online: calebislost.com",0
"Sad news. 

>US Army servicewoman and fitness influencer Michelle Young dies by suicide, leaving friends shocked nypost.com/2024/01/21/n...

#PSA: If you are struggling with suicidal thoughts, you can dial the 24/7 National Suicide Prevention hotline at 988 or go to SuicidePreventionLifeline.org.",0
"Bonus Question 2: 

In your opinion, should a parent have the ability to forbid any certain topics of conversation between their student and a counselor/therapist?
(i.e. suicidal thoughts, abuse)

Related:
www.sltrib.com/news/health/...",0
i kinda hope no one follows my bluesky so I can keep using it to scream my suicidal thoughts into the void,0
"I wish they would have told me how quickly it affects the brain… 3 days in and I was no longer having suicidal intrusive thoughts.

I knew after just a day I’d never want to go back.",0
ive had suicidal thoughts resurge after I thought I had defeafed them so many times that it's just annoying,0
"The situation eventually reached such a crescendo, what with others words and actions, that it led me down such a dark spiral of depression that I was close to being admitted to hospital due to suicidal thoughts.",0
That moment you realize you got 8 out of 8 symptoms and have been depressed for years ,0
"The End of New Beginnings- Yoonkook

Oneshot
Explicit - Graphic Depiction of Violence
M/M
~3.7k words

Tags:
Suicide Attempt (graphic description)
Suicidal Thoughts
Break Up
Heavy Angst
Depression
Canon Compliant/Canon Divergence
DDNE
Hopeful Ending

archiveofourown.org/works/23399029",0
"Just today I saw an ad for a psoriasis drug, one of whose side effects was suicidal thoughts.",0
"CW: self-harm, suicidal thoughts 

That’s about the age that I first had suicidal thoughts. Adults and kids were always so MAD at me for being myself. I didn’t fit in anywhere. I also think this is about the time I first started trying to regularly mask my neurodivergent traits.",0
"Because we all know Vets don’t deal with suicidal thoughts or make plans to self terminate, right…",0
Digital bibliotherapy as a scalable intervention for suicidal thoughts: A randomized controlled trial. https://psycnet.apa.org/record/2022-98051-003,0
"Most of my suicidal thoughts link back to money problems. Even if they're actually housing problems, if you have enough money you can solve whatever the other problem is. I've been doing ok because I'm not reflecting on it as much. One day I won't be able to run away from it, I keep brushing these",0
"Well, geeze, so-called “normal” people don’t even have suicidal thoughts. WTAF do they know about it?! ",0
"#Ghoap #darkteawrites Hurt No Comfort Thread from TWT
Prompt was: Somber Meadow
Tw: Canon MCD, Suicidal Thoughts, blood
Read Carefully 

Simon Riley only knew he loved John MacTavish the day that he died— there was no doubt in his mind that he wanted to spend the rest of his life with -- (1/8)",0
"Mentall Illness Books?

https://www.booksns.com/117149/

This may sound odd but does anybody have books that are mental illness focused (ie: depression, eating disorders, suicidal thoughts, etc). But without the whole epiphany at the end where they suddenly realize happiness is the answer? Sorry …",0
"Wegovy, Ozempic not linked to increase in suicidal thoughts, US study finds www.reuters.com/business/hea...",0
Why does Wegovey have suicidal thoughts as a side effect?,0
Identifying Factors Impacting Missingness within Smartphone-based Research: Implications for Intensive Longitudinal Studies of Adolescent Suicidal Thoughts and Behaviors: http://osf.io/e4ft5/,0
I literally cannot stop reposting porn on this acct by accident i’m gonna kms,0
i slept for like half a day because my mom didn't wake me up for whatever reason i'm gonna kms,0
"If I don't get molested in this fit ASAP, I'm gonna kms",0
INO HONE AND CHIIKAWA I'M GONNA KMS,0
One of my cats just pissed on my book case I'm gonna kms,0
My friend keeps talking about impregnating springtrap I'm gonna kms,0
Why do I not even have A03 or Tumblr I'm literally gonna kms why do I live under a rock ,0
If my work crush has a Bluesky I’m gonna kms,0
just swiped left on the loml on tinder i’m gonna kms,0
"antidepressants maybe kinda help, but what doesn't help is the THIRD ITERATION OF WITHDRAWAL when they can't maintain the monthly supply. I'm gonna style out this withdrawal a bit longer so there's backup for next time maybe? or kms",0
the only thing your sister really likes is medicine' my god i'm gonna kms,0
Oh my fuckinf god dude I'm gonna kms this expander thing in my mouth HIRTS SO MUCH.,0
"arcane spoilers without spoilers 

i fucking knew this season of arcane was gonna devastate me
i’m gonna go kms now thanks",0
This was posted in 2018 I’m gonna kms,0
If I don’t get it I’m gonna kms in the deep freezer,0
I keep trying to get sabo but I just keep getting judge or doflamingo I'm gonna kms ,0
I've been commuting to and from the city for work for almost a year and just today realized that my town's train station has free parking on Saturdays and Sundays brb i'm gonna go kms,0
"I'm actually gonna kms

What do you mean Trump won????",0
tweaking out again I'm gonna kms ,0
"AASUF77 I NEED NEW PC HEADPHONES FUCK I DON'T WANT TO SPEND MORE MONEY I JUST BUY A FUCK DUALSHOCK SSA8UWIE
SS I'M GONNA KMS",0
i’ve got an obnoxious case of the hiccups and i’m gonna kms,0
jungwon pfp or leehan pfp I'm gonna kms I can't decide,0
No it doesn’t I’m gonna kms,0
I’ve been working on an animation for Valentines day for a few weeks and I just fucking ruined it. I didn’t realize merging the layers on flip-a-clip would make them overlap like that and I have no idea how to reverse it. I’m gonna Kms now bye,0
It does look good on him... And I really appreciate that there are two of them ON HIS SCARF. this is so good I'm gonna kms,0
Guys I swear if I'm sick I'm gonna kms I do not have time for this,0
respectfully* i’m gonna kms,0
"TW// EATING DISORDER

I remember the time i went to the mental hospital because of suicidal thoughts/self harm &i also had my ed going on at the same time and they asked me if i ever binged & purged & at the time i thought i didn’t & they said using lax was a way of purging i i was gagged bc i",0
