text,depressive
Happy doctor who day to the show that saved my life many times from depression and suicidal thoughts though life struggles and was always there to be hopeful and show me everything I needed at just the right time. Glad to be a whovian,0
"To me, the only things that can’t be understood without experiencing them is; Rape, Postpartum depression, chronic diseases, being tortured/kidnapped, domestic violence, suicidal thoughts, living through a war and PTSD.",0
"Oh man. The last depression drugs I took made me suicidal. Every month they'd ask, ""Have you had suicidal thoughts?"" When I finally said yes they shrugged. I took myself off of them. Then last year I said to my doc, ""I feel like I'm going mad. I can't shut down my brain."" Then psych eval et voila!",0
"Nicotine exposure increases brain concentrations of serotonin and endorphins, which are important for mood regulation. Youth nicotine vaping is associated, in a dose-dependent way, with higher validated symptom ratings of suicidal thoughts, depression, anxiety, and inattention/hyperactivity.",0
I'm going over the worst separation you can imagine..16 years together...i have two kids and i live with my ex and we don't have money to go separate ways...she is bipolar and she 's having suicidal thoughts and really bad depression. I'm trying to survive mentally.,0
they are currently doing this to me. it is intensely stressful and making me have suicidal thoughts,0
"Step right up folks and spin the wheel! On Monday at 8 PM EST we will be streaming and raising money for To Write Love on Her Arms, a nonprofit raising money to find help for those struggling with depression, self harm, and suicidal thoughts.  I’m hoping all you lovelies will show up and support!",0
"#SuicidePrevention #BehavioralHealthIntegration #BHI
#mdlogix #bhworks

https://nemours.mediaroom.com/2021-07-27-In-Pandemic,-21-5-of-Teen-ER-Patients-Reported-Severe-Depression-and-7-8-,-Suicidal-Thoughts?utm_campaign=meetedgar&utm_medium=social&utm_source=meetedgar.com

#SharedFacts",0
"Treading Water. 

A modern AU set in the beautiful Gower Peninsula in south Wales. In which Ed stops a golden-haired stranger from walking into the sea...

Explicit, 22.5k words, Ed/Stede. Tags in Alt text

archiveofourown.org/works/619019...",0
"Not to alarm anyone, but it is kind of telling that the only time I ever have suicidal thoughts, its when I *try* to get help from the healthcare system here

I wouldn't act on any of it, but the thoughts did appear",0
"yeah i have a (very factionalized supernatural horror) exploration of depression and suicidal thoughts project that is still too close to me to really sit down and work on lol, i can’t imagine making straight autobio about that or fibro or anything else. i don’t need that!",0
"If Charlie Kirk read the Gender Acceleration Black Paper, it would confirm his worst fears, cause suicidal thoughts, then want to transition within 24 hours",0
"The majority of those who are suicidal don’t want to die, but rather, they want to escape the pain they are experiencing mentally. A pain that we can potentially overcome. I know it’s not easy, but I will never give up on someone struggling with thoughts of suicide.",0
Sometimes I wish I could just disappear!,0
"I spoke with @SFreedenthal about her book, ""Loving Someone With Suicidal Thoughts"" for Episode 132. As always, Stacey brings deep insight and no BS to her work. We talk about creating support teams, feeling manipulated, and more. With transcript ...",0
"I spoke with @SFreedenthal about her book, ""Loving Someone With Suicidal Thoughts"" for Episode 132. As always, Stacey brings deep insight and no BS to her work. We talk about creating support teams, feeling manipulated, and more. With transcript ...",0
Casual Clownin' Sketch 1/4/2025,0
korean fried chicken just arrived suicidal thoughts postponed,0
"#Isolation

https://www.vox.com/platform/amp/the-highlight/2019/10/30/20936636/suicide-mental-health-suicidal-thoughts-teens?utm_campaign=meetedgar&utm_medium=social&utm_source=meetedgar.com

#PersonalNetworks ! #SharedFacts #BehavioralHealthIntegration",0
"I'm so goddamm terrified. My suicidal thoughts have never been this bad, they're actually making me cry. They haven't done that since Jr High.",0
"Suicide risk among female doctors prompts call for action morningstaronline.co.uk/article/suic... 

Nurses under ‘intolerable stress’ are increasingly suffering suicidal thoughts. morningstaronline.co.uk/article/pnur...",0
"that was my mom's father. she lost her sister a few months later. and my dad lost his dad last November. after all that, along with my newest friend group randomly started ghosting me, and I was behind in school, I was in a really bad mental place, and I was beginning to have suicidal thoughts.",0
"This is my favorite album to have suicidal thoughts to in the dark.
Please no one freak out. I'm not new here. These thoughts are a symptom of illness because my brain is sick. I recognize that. I'm not going to act on them. I've had a few decades to learn how this goes.",0
Suicidal thoughts -2,0
"Lol nothing. Just old stuff resurfacing after a training at work made me realize that legally my dad not giving me access to resources to help with my ADHD, self harming, suicidal thoughts and depression was actually Neglect. One of those moments where I knew that...but now I Know that.",0
"Hey #LongCovid community:
Have you been reinfected with Covid this year?
If so, how did it make you feel?
what were your worst symptoms?
Have you returned to baseline?
I was reinfected in July. I had especially terrible neurological symptoms.
Suicidal thoughts and dissociative episodes.",0
"New study finds that Latinx Sexual Minority Adolescents with the highest rates of bullying, alcohol, poor grades, and use of electronics are at the highest risk for suicidal thoughts. #AAS365 cc: @youthsuicideres 
https://doi.org/10.1007/s10903-020-01128-w",0
Me after reading allergy med warning that said: “severe mental health problems have happened with this drug or after it had been stopped… These problems include depression or suicidal thoughts… Watch people who take these drug closely…”,0
"With the result today I bought myself a pizza and asked my SO to come by 

I'd have suicidal thoughts all night and isolating myself like I do all the time wouldn't have been a good idea 

Imma try to distract myself as much as possible or make myself happy idk how yet",0
Love all the antidepressants with side effects of “May increase suicidal thoughts.”,0
"I spoke with @SFreedenthal about her new book, ""Loving Someone With Suicidal Thoughts"" for Episode 132. As always, Stacey brings deep insight and no BS to her work. We talk about creating support teams, feeling manipulated, and more. New transcript! ...",0
"I spoke with @SFreedenthal about her book, ""Loving Someone With Suicidal Thoughts"" for Episode 132. As always, Stacey brings deep insight and no BS to her work. We talk about creating support teams, feeling manipulated, and more. With transcript ...",0
"I spoke with @SFreedenthal about her book, ""Loving Someone With Suicidal Thoughts"" for Episode 132. As always, Stacey brings deep insight and no BS to her work. We talk about creating support teams, feeling manipulated, and more. With transcript ...",0
"I spoke with @SFreedenthal about her new book, ""Loving Someone With Suicidal Thoughts"" for Episode 132. As always, Stacey brings deep insight and no BS to her work. We talk about creating support teams, feeling manipulated, and more. New transcript! ...",0
"I spoke with @SFreedenthal about her new book, ""Loving Someone With Suicidal Thoughts"" for Episode 132. As always, Stacey brings deep insight and no BS to her work. We talk about creating support teams, feeling manipulated, and more. New transcript! ...",0
"I spoke with @SFreedenthal about her book, ""Loving Someone With Suicidal Thoughts"" for Episode 132. As always, Stacey brings deep insight and no BS to her work. We talk about creating support teams, feeling manipulated, and more. With transcript ...",0
"I spoke with @SFreedenthal about her book, ""Loving Someone With Suicidal Thoughts"" for Episode 132. As always, Stacey brings deep insight and no BS to her work. We talk about creating support teams, feeling manipulated, and more. With transcript ...",0
"I'm clinging to ""I hope they're too stupid to totally ruin everything"" like the Empire in Star Wars when it left an easily accessible total self destruction port on two consecutive Death Stars",0
"To you it's a life altering drain, you'll be stressed most of the day trying to figure out how you're going to pay rent tomorrow--- but to me it means nothing, i can ruin everything you've ever worked for in a matter of minutes.

You ARE nothing, & you'll always BE nothing.
#FinDomme #finbrat #brat",0
"saki: she's so kind even now after i've ruined everything, i don't deserve this.... making her care about me this much is just cruel, i'll just ruin her and her nice happy life if i stay and keep her tied to me",0
" You have a double tomorrow; If you miss your payment this week, you'll be behind...that means I get the pleasure of slowly starting to release *all* of those nasty pics to your boss, your wife, and your kids....
I'll ruin EVERYTHING you've ever worked for.
#findomme #blackmailplay #homewrecking",0
"Then his brain starts to really torture him.

/what if he doesn’t like me back?/
/what if i ruin everything?/
/what if he never talks to me again?/

He tosses and turns, until he finally passes out sometime around 3am.",0
"Revenge and Justice | Commission

I sure hope no blondes with robo arms comes in and ruin everything

Models @yinyama3d.bsky.social 
Raven Branwen
Weiss Schnee

SFX/Voicepacks (Subs gets the sound version!)
@hentaudio.bsky.social 
@lecheryamoreva.bsky.social 
@opennsfwsp.bsky.social 

#rwbynsfw",0
such ruin you will make of me... the wrecking of everything i tried to preserve... #sorrywereclosed,0
they absolutely do ruin everything. in retrospect i rly should have seen that coming.,0
Oh I can see how that would Ruin Everything lol,0
"WHY did Nestlé remove the covering for Hot Pockets? The box says it was for the ""environment"", but I know damn well that ""we use CHILD SLAVERY in Africa to bottle out water"" Nestlé is not doing that. SO WHY NESTLÉ! WHY MUST YOU RUIN EVERYTHING YOU TOUCH!! MY FINGERS AREN'T MEANT FOR SUCH TASKS!!!",0
"ITS NOT YOUR FAULT I RUIN EVERYTHING 
AND ITS NOT YOUR FAULT I CANT BE WHAT YOU NEED",0
"When he said “everything app” he meant I’m gonna “buy every app” … 

Never like TikTok tho so I can’t think of a better person to ruin it.",0
"I fucking ruin everything 
Bf won't respond because in a panic I put him on the spot asking him if he'd come with me if I needed to flee the country

All he could say was he doesn't have an answer

I'm a fucking moronic idiotic piece of shit",0
"I think when Bluesky first popped up it wasn't seen as malicious or anything however people are bringing other social media ideas and bringing it on here

don't get more wrong obviously some people do do it was engagement however we can't let a few bad ones ruin everything.",0
what’s crazy is i knew from the second they dropped the amphoreus cast that anaxa would ruin my life he was the only one that had caught my attention back then oh this is the worst timeline i hate everything,0
"over on my cohost page, i've added some further context for the themes and story behind, within, and around my new album. i have provided screenshots below as they go well above the character limit, complete with descriptions for those that need it 

cohost.org/listeninggar...",0
"In Throes of Increasing Wonder: An Interview With the Vampire Zine by @msclairebiddles.bsky.social is so lushly composed that I'm almost moved to start LARPing the Masquerade. Might go hard enough to get bullied by Garth Ennis, let's see.",0
"CastleVania: Portrait of Ruin is going well.  I seem to have averted the bad ending and am now down to the grouping of four individual portraits.  Since I'm playing blind, I'm doing a quick Owl Morph sweep to be sure I caught everything.  Castle done, only portraits left.  Shouldn't be too long.",0
"it is, i get yelled at, forced into an awkward situation, and made to apologize. and the second i do anything that isn’t this, i ruin everything for others. i make people constantly uncomfortable around me because i don’t know how to talk and i’m so fucking unhappy.",0
"I just ruin everything I'm just cursed with depression  adhd and chronic pain I'm unlovable    
I can't stop having breakdowns 
I don't know how my boyfriend  deals  with this  and me   I feel like  I' m a failure",0
This country foolishly handed Trump the power to spend the next four years trying to ruin everything held dear by the innumerable people he believes have wronged him in some way. At this point I doubt that braying list of resentments has much else to live for.,0
"Not on a bet!  I like peanut butter just fine, but I hate mayo in anything and everything. No way I'd ruin perfectly fine peanut butter with it!",0
I just had a scuffed run that was going great until the god damn violet vessel had to RUIN EVERYTHING,0
"I have to say that it's quite the experience to wake up to 1 million news alerts about America sliding into ruin. Since I'm in Asia, everything happens while I'm asleep.",0
"Hey, psst, hey hey.

Happy New Year! 

I hope 2025 will treat everyone better and that the idiot dickwads that ruin everything get struck by a billion volts of karma along with untieable shoelaces they'll forever trip over... even when they don't wear shoelaces.

Have a good and safe time!",0
If I could just stay like this all morning enjoying my coffee and the snow I’d be a happy boy. But no work has to ruin everything….,0
"You teach me nothing except for the fact that there are plenty of blue cultists that are just as unhinged as the red cultists.

Yes, Democrats have in the past made improvements to society, while Republicans generally ruin everything.

That doesn't change anything about what I said.",0
"Jade - Oriental Beauty

One of my favourite settings are tropical outdoors locations. It does have its challenges, but it's very rewarding. I remember it was a pleasure to shoot Jade, she was posing for me perfectly, although the strong wind did everything to ruin our verbal communications.

#Jade",0
Are there options other than Starlink for Ukraine? And are those uncompromisable? I regret our loudest complaint about low Earth orbit satellites seems to have been that they ruin the night sky. Why DO we keep making it so simple for the kleptos to control everything?,0
"I have no conclusion or summary to this. It just sucks. That’s all. I’m still pissed off everything I built on Twitter, personally, professionally, and creatively, is a hollow ruin. But those are the risks of building a platform on an app you don’t own. And why you should have your own channels.",0
"I hate when action shows ruin everything with a unnecessary sex scene that adds nothing to the plot.

I always fast forward through sex scenes, dumb relationship drama, and rape scenes.",0
I need WB Games to explode like yesterday - they ruin everything they touch; Shadow of Mordor/War are two of my favorite games ever and they just axed Monolith and now we're really never getting anything more of that series ,0
"the profile picture is the gateway to internet friendship. we have the opportunity to select the face we display to the internet, and the wrong choice can ruin everything. it’s a delicate game. especially on goodreads, where i have no social overlap with the people i want to add. so, what to do?",0
I can’t fall asleep on the couch tonight because it’s by the tree and I’ll ruin everything.,0
"I don't love Chow backing down on Ontario Place but on the other hand, I invite Ford to immediately ruin the Gardiner like everything else he touches",0
Why do I always ruin everything,0
Ha! New word for me. I worry that I take up too much of your time. In any case it's a delight to chat with you ... you are one of those rare enlightened Americans. [Now did I ruin everything by that comment?],0
"I fully agree with this, I think ""phones ruin plots"" is greatly overplayed and I roll my eyes a bit when writers complain about it. Like yeah, phones are useful but they don't just... give us everything we want? They're not magic! It seems lame to go ""Oh, stories don't work any more""",0
"In a sense that he will ruin everything for everyone now and for decades to come and there will still be a baffling amount of people trying to gaslight you into believing he was great actually, yes. I can see that happening.",0
Good. I hope the plaintiffs RUIN that cesspool and take everything,0
"Joke's on you. I ruin everything with my face.

Wait...",0
"Sure they are. That's why a man who hated you suddenly loved you enough to marry and impregnate you within a year.

Maybe I will ruin everything. I am not going to bow to someone like you.",0
"I think it's safe to say that, if this is legit and actually happens, then Sony will the Disney of anime. They own almost everything and they ruin all of it.",0
I block any and all phobes. I hope to not run into any Nazis. I'll block them too. Do those types of people have to come and ruin everything? Gah!,0
"I said on Twitter that we should've gatekept internet from idiots because it takes one idiot with charisma to ruin everything.

I'm glad Bluesky people are gatekeeping now.",0
I wonder (and sometimes hope?) that AI is ultimately going to ruin the internet completely and that we’ll all need to go back to analogue everything,0
I ruin everything because I’m such a fat fuckigng cow. The moment I saw my stomach in those leggings I wanted to vomit. It wa so huge and round I looked pregnant. I’m disgusted with myself. I almost felt better enough to where I thought I deserved to be with them anyway I don’t deserve anything,0
I am glad President Biden did this. They have all suffered enough and we all know perfectly well that MAGA was going to do everything in their power to ruin their lives.,0
Men ruin everything. I can't even enjoy Texas beating Texas A&M on a last-second field goal set up by a Case McCoy scramble for the ages in The Last Meeting Ever in the rivalry.,0
I always always always always ruin everything,0
"I mean, if Bandcamp goes down, I have literally no idea what to do. To say it’s basically the only thing keeping satan afloat would be a vast understatement, so I guess that’d be that if it died. Fuck me, venture capitalists just fucking ruin everything, don’t they?",0
I hate how much people care about how much pokemon cards cost. I hate scalpers. I hate people who ruin everything for everyone because it *might* make them some money. I just want to collect the cards I like look nice and I just cause bc of assholes,0
"Pretty much it. I'm still in absolute shock of the events of the last decade. I really believed that we were finally going to have a woman president and that everything would start getting better. Yet here we are. Our country brought to ruin by a cult of ignorant troglodytes.
It breaks my heart.",0
"bots are the worst. They just spam and ruin everything. 
btw I can do this just DM me for my portfolio. ",0
"Right. I'm going to bed.

Try not to ruin everything in the eight hours or so until I wake.",0
I left out the words Orange and bed. William Thee Orange and I had been sleeping on my sister's insanely comfy sofa since an electrical fire ate my kitchen on Election Day. Turns out a little fire generates enough soot to ruin everything I own.,0
"It’s a figure of speech, bro. It’s a colorful way of saying that Christians ruin everything, which I believe is a factual statement.",0
"Idk, I don't want politicians to ruin the peace we have here. I fear it would lead to people like Zuck and Musk joining and that would ruin everything.

If politicians actually _wanted_ to engage with their constituents, then yes, social media sites would be the best place to do it.",0
"I'm armed to the teeth
Like a fucking animal
Like a fucking animal
I ruin everything
I get my bony hands on",0
They are looting us. There’s no other explanation. Everything they are doing is geared to ruin an economy. Why? I don’t think Trump cares. I think he’s lining his pockets and he’s just going to rob us blind.,0
"According to Pierre Poilievre, our economy is on the brink of collapse and Trudeau has destroyed absolutely everything that used to be good about Canada. We are a country in ruin. 
I cannot take this guy seriously. #cdnpoli #cdnmedia",0
"I'm regularly grateful that I loved OFMD S2 just as much as I loved S1 because I can so easily see why that wasn't true for everyone. I do think writing Tree Change across the release of S2 helped me process how differently people viewed it (Ch2, Ch4, Ch9x2)

archiveofourown.org/works/491282...",0
"CW: Tech nerdery

I have a real bugbear and that is the book ""Clean Code"" by R. Martin. I'm picking through the thicket of a solution where EVERYTHING has been abstracted to the Nth degree because ""Uncle Bob said so"". Guys, SOLID principles shouldn't ruin your code's scalability or maintainability.",0
"Same. Every so often another one shows up here and it's very exciting. But, I spent so many years getting that list of people l like. None were random. I read every single bio before following people back. Whoosh, gone because Elon ruined it, and now he's trying to ruin everything else too.",0
I can't believe John Wilkes Booth took this from us  racists ruin everything,0
I’m done with social media. I just had someone try and blackmail me for money with my pictures. Then saying he was going to turn everything in to the fbi through email. He said then to ruin my career. All for money. I can’t deal with this and this society anymore. Why?,0
"I just hope it doesn’t ruin your experience 

It should be magical and explore everything and everywhere.

My next trip I have to go to Northern Ireland, which I didn’t last time. 

Viator.com is where we planned some tours!",0
"There are SO many around here, I see one every day like a plague of bad taste. I can't even begin to have a good time before a dang Cybertruck jitters up to ruin everything",0
"Oh, FFS.

If you can't bring yourself to talk to another person, you shouldn't be dating in the first place.

I hate it here. Tech Bros ruin everything they touch.",0
"I wonder if TMZ ever consider* that no fictional universes seem to have a TMZ in them because that would be awful and ruin everything?

*No.",0
"There's a mating pair that come here every year. I usually don't see them this early, but they came on by to say hello until the seagulls chased them off.

Autocorrect (and a propensity for typos) ruin everything!",0
"Damn, I don’t mind a Brewdog when there’s nothing better on offer. These asshats ruin everything.",0
"And not just “no”, it’s “and I will fucking ruin everything, no.”",0
"I have a neighbor named Jeff who is also divorced, but he’s a tRumper . They ruin everything!",0
"I love how the U.S. can just ruin everything for everyone, and the rest of the world gets no say. Hell, even americans barely get a say",0
"I did get rid of Twitter because it wasn’t fun there anymore. But Insta and FB are still doing for me what I need them to, so I’m holding onto them. And you make an excellent point. Why do those jerks get to ruin everything for us?",0
i ruin everything,0
"I hope you trumpy idiots get everything you voted for. This is not my lesson to learn, but you ruin it for everyone.
apnews.com/article/chin...",0
"Please be the @newyorkornowhere.bsky.social collab so I can go into financial ruin before the season starts 

One of everything please",0
"Number 1, it really sucks, and I'm sorry....

Number 2, we really do ruin everything because I was like number 70....",0
"Butler doesn’t ruin songs for me, but I don’t feel his vocals are Arcade Fire’s main draw — whereas I started listening to the National after reading an article talking up Matt Berninger’s baritone, & once I heard him sing, had to listen to everything they made.",0
"Ugh, mosquitoes try to ruin everything! The numbers dropped here after several warblers were hanging around, snatching them out of the air! That was very cool to see. Now I need them to come back because the mosquitoes have returned.",0
"It's so funny when people have one-sided beef. ""Ugh I hate that Steve came here from Twitter, he's going to ruin everything"" and then you check Steve and it's all just ""me at the beach :)"" ass posts",0
"Everything is important. Beat him over the head with every single thing, continuously, large or small. Waste his days, every single day until he's gone forever. Frivolous lawsuits directed solely at him. Ruin him. Mind you, I can't believe the Democrats fell for the old Nazi blitzkrieg trick.",0
Yesss please ruin my insides and steal everything I have  I don't deserve them~,0
Don’t let the bears late game brain fart let you forget Jim Nantz went out of his way to jinx Bates and ruin his perfect season. And while I don’t believe in a higher power or any form of mysticism I believe Nantz deserves to lose everything because of it.,0
I takes only one person to ruin everything. This is a heartbreaker knowing this area is usually a celebration hot spot. It feels like every holiday is now followed by a tragic event.,0
Ugh. Does he have to ruin EVERYTHING that I love? FFS.,0
hhhh why must i ruin everything.,0
"I want to believe PBS. But I feel like I'm being manipulated by every other news platform (Washington post, nyt, ABC news) or will it be bought out by SOME oligarch ??? Why do rich people ruin everything???",0
And I hate when they find my skeets cause they ruin everything ,0
