text,depressive
"you are worthy even if you:

are battling depression

fight anxiety daily

have suicidal thoughts

are really struggling

have any mental illness

don’t feel worthy

(i love you guys so much. i hope you know that )",0
"Well dunno really 
Just saw them posting suicidal thoughts and I dmed them to see if they're ok",0
"There was a claim — maybe a rumor — that three kids at our local school expressed suicidal thoughts, and one parent’s reaction was to go on a jihad, saying THERE’S NO EXCUSE FOR THAT KIND OF BEHAVIOR, blaming bad parenting, and ranting against teachers.",0
"#SuicidePrevention #Depression #Anxiety #Bullying #Isolation

https://www.vox.com/platform/amp/the-highlight/2019/10/30/20936636/suicide-mental-health-suicidal-thoughts-teens?utm_campaign=meetedgar&utm_medium=social&utm_source=meetedgar.com

#PersonalNetworks #SharedFacts",0
"ah shit damn guess i should have just been killed instead that would have been a better fate apparently.

pro tip: if you sound like a trauma victim's suicidal ideation thoughts try reconsidering your ghoulish take",0
"Acceptance has been so key for me. At times, I was having thoughts that being actual dead would be better than being living dead (suicidal ideation is extremely common in those with #mecfs). I've turned those thoughts around primarily through acceptance and accommodation.",0
"I was a depressed kid with undiagnosed inattentive ADHD, my first suicidal thoughts occurring when I was 7 or so. My only attempt to this day was when I was 13, swallowing a bottle of Tylenol and 10 minutes later regretting it, telling my mom, and being rushed to the ER where ipecac took care of it.",0
i genuinely just hate my parents like i just want out but i know i never will unless i kill myself. like thats truly the only way out,0
Happy World Suicide Prevention Day! A day for celebrating decisions to live and to remember those who died by suicide. A short thread on things you can do to help those struggling with suicidal thoughts and behaviors @IASPinfo #WSPD 1/11,0
"wow i didn't know this meme came from a short film, it's actually quite good 

cw: may be sensitive to those who have experienced suicidal thoughts 

vimeo.com/117371025",0
"Reading an article about a woman who went through postpartum psychosis and did the absolute worst to her kids… and how she was actively seeking help for suicidal ideation and intrusive thoughts, but because it’s not actually in the DSM, no one mentioned it once to her or her husband.",0
"And then again, in 2024, I had take a leave from college because I couldn't take it anymore. I was having suicidal thoughts again, I was losing my mind over not getting good grades, I could wake up most days, I wasn't even going to class. So I decided to talk to me dean to put a pause to all of this",0
"I'm basically non-functional without adderall (not to mention how it helps my anxiety) and my depression is... manageable with an SSRI. 

I've struggled hard with suicidal thoughts and self-harming and for the first time I'm not okay but I'm better than I was. 

Fuck this fucking ghoul.",0
What Worked? Understanding the Reasons for Reductions in Suicidal Thoughts and Negative Emotions After Visiting NowMattersNow.org (preprint) #openscience #PeerReviewMe #PlanP,0
I especially love the ones where antidepressants ‘may cause suicidal thoughts’……so take this supplement to counteract this,0
"Once in 8th grade , after getting caught planning to mulligan a little too early , I was taken to the hospital for a psych eval and the nurse says to me in this embarrassing tone “you want to kill yourself ? Uhm . . . why ?” And ever since then ive been too embarrassed to form any suicidal thoughts",0
"I won't kill myself.
I won't",0
"SUICIDAL SUBJECT:
Walmart on Walton Ave
However they do not have a description of her or her vehicle. She was on the phone with WCSO and told them she was having thoughts of suicide, they went to transfer her to BGPD (jurisdiction) and she hung up. BGPD on scene 8:26 looking for her , IN CUSTODY",0
"+tasks that seem so basic. if you didnt caught up on it yet, suicidal thoughts may birth from depression.

more generally, some people 𝘳𝘦𝘢𝘭𝘭𝘺 are lacking empathy and it seems you dont realise how hurtful words can be.

+",0
"I wanna thank you all for being there when i was on my lowest, when the suicidal thoughts were in my head, you all would be there for me. And I'm so thankful, i love you all to the moon and back. Hope we all have a nice life next year and given the happiness we all deserve ",0
Nny is a character in the graphic novel Johnny the Homicidal Maniac by Jhonen Vasquez. Vasquez also made Invader Zim but Johnny has always been my favorite of the 2 since I was a kid. I struggle w/ homicidal & suicidal thoughts so I have a soft spot for him.,0
"5/Other objectives include reducing suicidal ideation, reducing illicit drug use, and reducing bullying among students who identify as LGBTQ+. YBRSS data is what tells us that LGBTQ+ experience bullying, illicit drug use, and suicidal thoughts at disproportionate rates.",0
"Please stop

I swear to you, life here is still unbearably difficult

I just want to save my little baby& my family & reach our goal to provide everything food,water & my treatment& have a simple warm shelter that keeps us safe

Help us survive
Donate &repost,be our miracle 
gofund.me/78ffd496",0
Oh how I wish we could all ignore those people. I can remember the relief I felt when he had to disappear from the stage. And here he is again. Him and his circus. What a nightmare .,0
The suicidal thoughts:,0
"(Although there's a rather sad story going with it, because of all the shit that his voice actor Ahmed Best had to endure afterwards.

TW suicidal thoughts at the link.)

web.archive.org/web/20200526...",0
"Sometimes, while looking at this black and white picture of me, I wonder if this was the last time I could be so happy and carefree. The picture itself has gone through hardships, as I did, contrary to Dorian Gray’s portrait. #selfie",0
- uncomfortable with someone whilst fueling their suicidal thoughts! glad i dont use this app much,0
"DBD bringing Dracula and Alucard in has changed my life, extremely positive days lately. Like one person trying to hate on my friends and I didn’t even damp my mood. I actually wake up and look forward to living. Suicidal thoughts postponed for now.",0
"Day 2 of yet another epilepsy drug increase. Lamotrigine increase always gives me akathisia for a day or so, which is an awful side effect.

Feel sick. Can’t sleep. Taking other medications in what I know are seriously dangerous doses, in an attempt to cancel this out. Repeatedly bad decisions.",0
"It's Lonely at the Centre of the Earth, by Zoe Thorogood 

Heavy trigger warnings: depression, suicidal thoughts, mental health. This graphic novel / memoir may be hard to read if you've struggled with the above. It gets very heavy and it's unusual and random and sad and scary and beautiful.",0
suicidal thoughts are lame. be the homicidal one in your family,0
Gonna write passively suicidal Riku one day cause I know that boy has intrusive thoughts he lets slip every once in a while,0
"#SuicidePrevention #BehavioralHealthIntegration #BHI

https://nemours.mediaroom.com/2021-07-27-In-Pandemic,-21-5-of-Teen-ER-Patients-Reported-Severe-Depression-and-7-8-,-Suicidal-Thoughts?utm_campaign=meetedgar&utm_medium=social&utm_source=meetedgar.com

#SharedFacts",0
"#SuicidePrevention #Depression #Anxiety #Bullying #Isolation

https://www.vox.com/platform/amp/the-highlight/2019/10/30/20936636/suicide-mental-health-suicidal-thoughts-teens?utm_campaign=meetedgar&utm_medium=social&utm_source=meetedgar.com

#PersonalNetworks #SharedFacts",0
"Recently the council said they had provided an alternate service in a public space (where everyone with depression wants to go to talk about their suicidal thoughts) as soon as the latest court case was over, they cut that provision too. The money they could save if they just funded what was here",0
"""I wish it was easier."" I say. 
But 
I really wish it was better. 
That existing didn't 
Burden your bones. 
That pain didn't nest so deeply. 
Overwhelming
Your ability to be 
Without some form of agony. 

I wish it was better 
For you and me.",0
"If you are having suicidal thoughts, please call 988.
#SuicidePrevention",0
Sexdick saved me from suicidal thoughts,0
"Kleinod
Jungkook/Taehyung

CW: Suicidal Thoughts

Jeongguk suffers from chronic pain.
Taehyung loves to talk but no words will ever leave his mouth. They both feel irrevocably broken. Life was nothing but hardship for them. The two of them meet.

archiveofourown.org/collections/... #btsfics",0
Good morning to everyone who survived their own suicidal thoughts this year. That shit is so hard and I’m VERY proud of you. ,0
i have not ever had suicidal thoughts but if i got stuck in the anxiety hole again and couldn’t get out? it would come for me eventually. big fan of “store bought is fine” brain chemicals over here,0
"Debi Wimberley of Phoenix, Arizona was on a heavy dose of OxyContin that did nothing for her chronic pain. She had suicidal thoughts after living like this, but when she started using cannabis and educating herself on its benefits, her pain reduced from a 10 to a 3 and she got her life back.",0
" A Crown of Ivy and Glass  by Claire Legrand


Plot was very interesting and engaging! It did feel a bit difficult to read, but it suited the setting and was paced super well

TW: Panic attacks, self-harm, suicidal thoughts, bl00d

#booksky #bookreview",0
#hourlycomicday part 9,0
God gave me manic depressive disorder and I will be damnned if I don't make my manic episodes everyone else's problem,0
"yea so i fucked up and i pushed my own boundaries and standards aside and I hate myself and this isn't the experience I wanted trying to actually make a buck

again i just got used until I couldn't anymore cuz ew and then just tossed aside with nothing. Great start lily.",0
"There is no way to mark a text post as content dangerous, so behold a screenshot. 

If you read the screenshot and send me some nonsense about crisis help of a certain kind, you didn't read the post fully. That is not helpful and I'm just going to block you.",0
"Suicide related books

https://www.booksns.com/85799/

Hey y'all, I have a bit of an odd request. I was talking to a friend recently and they feel very strongly that choosing to end one's life by suicide is selfish and cowardly. As someone who has struggled with SH and suicidal thoughts, I …",0
"I think this song has a lot to do why I never made it full into suicidal thoughts. 

I always started thinking about that line... and then stopped.

Music is fucking powerful.",0
Another time in the same hospital for  suicidal thoughts I charged full force into double doors trying get out of the hospital 3/3,0
"10. What I hate the most about myself

Many things",0
"I'm feeling depressed and suicidal today because I can't provide food for my kids - if you see this please say hi, it makes a huge difference. 

I need support, and a chance to rebuild my life 
gogetfunding.com/help-my-fami...",0
"I’ll be okay, I might not be right now. But i know eventually i will be.",0
ive been having really heavy ŝû!cîdãļ thoughts and general feelings of worthlessness and im just on edge since friday and i KNOWWWW it's bcs my periods coming but what the fuck do i even do to combat them ,0
"Mixed states are the most dangerous to me. Every hospitalization is associated. It’s like “hey here’s a bunch of suicidal thoughts and also here’s the energy and initiative to act on them”

Past few days I was largely unaware. And it wasn’t that bad at all relatively but ya … solidarity",0
"I spoke with @SFreedenthal about her new book, ""Loving Someone With Suicidal Thoughts"" for Episode 132. As always, Stacey brings deep insight and no bs to her work. We talk about creating support teams, feeling manipulated, and more. I hope you enjoy! ...",0
"I spoke with @SFreedenthal about her new book, ""Loving Someone With Suicidal Thoughts"" for Episode 132. As always, Stacey brings deep insight and no BS to her work. We talk about creating support teams, feeling manipulated, and more. New transcript! ...",0
Recently can’t stop thinking about how much I wanna d*e ,0
"I just spent a moment having philosophical thoughts about this hot take on whether we should be kind to the suicidal. Perhaps you were thinking specifically of the Covid un-cautious...

And then I realized that was not remotely what you meant .",0
damn I am kind of trapped in this depressive spiral in my brain and I am having many upsetting thoughts. and the place I'd usually post about them is nonexistent now. and nowhere else has a mutuals only option. so I will fester,0
"The truth is that I haven't been very well, I fell into a depressive episode again and the thoughts of disappearing returned. When I went back to therapy, Pandora's box was opened and it has been very difficult for me to heal parts of my past that I thought were already resolved.",0
im just kms i dont care about making money or being thin anymore i just wanna die i dont care anymore nothing matters,0
"Increased risk for suicidal thoughts and suicide attempts among adolescents exposed to the early phase of war in Ukraine 

#Ukraine #Adolescents #MentalHealth 

www.utu.fi/en/news/pres...",0
I wonder if it's because things like alternate universe Miss Piggy doing phone sex and Beaker and Honeydew working in a leather bar and Kermit having suicidal thoughts was considered maybe too dark by the Muppets' current corporate masters.,0
"No hope left, am completely financially screwed, SSD is taking forever, I really can't do this anymore. I wanna crawl into a hole and die",0
"The accused student denied the accusations about him “drugging and raping” female students and said that he has been in touch with the police (not sure in China or at Cornell), according to a screenshot. He also said that he’s had suicidal thoughts since the accusations came out.",0
As someone who has pulled a lot of overtime over the years let me just say 60 hours at work is when the suicidal thoughts really start to hit hard. This guy is a twat.,0
Acknowledging that I'm probably gonna die a lonely POS should give me clarity or peace but it mostly just makes me wanna self-destruct quicker,0
"""Bloodletting""

Vampire AU, NSFW, vampire Barto, vampire hunter Hakuba

archiveofourown.org/works/34791091",0
"Gonna slap a TW on this for talk about suicidal thoughts

I’m not doing very good lately; I rarely am this time of year. I’m sticking around and it’ll pass, it always does.",0
One time my doctor prescribed me something and said “a common side effect is suicidal thoughts…so if you want to kill yourself…don’t.”  Doctors are a silly bunch. Glad you’re doing okay.,0
"A few people contacted me as they were concerned, so I thought I better write it here.

I do not have any suicide thoughts. I am struggling and writing about it, but no where near suicidal.

The “if I would die now” was a way of thinking about my life until now. 

Thank you for looking out for me ",0
"CW: suicidal thoughts.
Not really an interaction, but Pica goes to a very dark place, mentally.
From Royal Magpie's Oath

#writingprompt #amwriting #queerwriters",0
"Interoceptive Accuracy, Sensitivity, and Attention are Associated with Suicidal Thoughts and Behaviors: http://osf.io/5zmh6/",0
"i have literally had a depression diagnosis since july 2015, and not once has a medical professional thought how i interact with depressing/suicidal thoughts as weird or unusual. like that part kindof flabergasts me... i have used depressive spirals/episodes as a descriptor since 2019... the fuck?",0
would you rather have suicidal thoughts or double it and give it to thom yorke,0
"When I say I have mental illness to the point that it's a major contributing factor in me being on disability, I fucking mean it. I'm doing better than I used to be but a look from someone used to cause me extreme emotional distress and would sometimes cause suicidal thoughts.",0
"Yep. Migraine, Endo and PMDD, are just a few of things docs have ignored in my fam cus we're female and shld just deal with it or we are making it up. But every dude I know gets treated straight away for severe pain or suicidal thoughts etc.",0
"This drug may cause suicidal thoughts or tendencies, especially for users under age 18…

Sounds like a real winner of a cure!",0
"Just got a message from someone on linkedin congratulating me for 5 years of working at a company i havent worked at in 5 years lmao (for those who dont know the lore, I was having serious suicidal thoughts while working there )",0
"A teenage boy ended his own life after expressing his suicidal thoughts to an AI chatbot, which failed to intervene.

These are the consequences we're going to see with a growing AI industry with little to no concern for user safety.

techcrunch.com/2024/10/23/l...",0
"More cops behaving badly, via @nypost.bsky.social ‘ex-girlfriend was involuntarily committed for five days and did not display any suicidal thoughts during that time, according to medical personnel...' cc @radleybalko.bsky.social nypost.com/2023/09/24/p...",0
A crisis of community. That is how a farmer speaking about his journey with depression and suicidal thoughts put it. We have a crisis of community in the US.,0
"Yesterday I had serious thoughts about planning a suicide attempt and now that I am less suicidal I am scared, concerned, overwhelmed and I don’t know what to do.",0
"Dear Volodymyr Zelenskyy, dear Ukrainian friends, you are not alone.",0
The cheese stands alone,0
Every single “you are not alone” message rn makes me tear up a little,0
"Your dignity honors the bravery of the Ukrainian people.

Be strong, be brave, be fearless.
You are never alone, dear President Zelenskyy.

We will continue working with you for a just and lasting peace.",0
" Polish PM Tusk says Ukraine 'not alone' after Trump-Zelensky clash. 

""Dear Volodymyr Zelensky, dear Ukrainian friends, you are not alone,"" Polish Prime Minister Donald Tusk wrote on X following Ukrainian President Volodymyr Zelensky and U.S. President Donald Trump's clash on Feb. 28.",0
When you realize JD Vance was the last guy alone with this couch,0
"I forgot my headphones AT HOME omg  
I CANNOT be alone with my thoughts",0
"America lost its designation of ""Leader of the Free World"" today. Not my opinion, European leaders are saying it. We are alone and despised.",0
Heartbroken... Sigh. Shits bad out there folks. If you're struggling for any reason - don't try to tough it out alone: reach out to people. We need each other.,0
Well that shit was triggering to watch. To all who have been abused by narcissists and had to deal with that kind of nonsense…you’re seen and not alone if your anxiety level just spiked off the charts.,0
"World leaders have been giving messages of support to Ukrainian President Volodymyr Zelensky following his clash with Donald Trump at the White House, with the EU chief saying ""you are never alone""",0
"Friday and again alone in the office 
@ma-queue.com #MaQueue @purelygayporn.bsky.social @puphawaii.bsky.social @xxxmenpt.bsky.social",0
I can’t possibly be alone in this sentiment.,0
"I'll repeat yet again: America is not our ally.

Europe stands alone, and has to do without those sociopathic bullies across the ocean.",0
"We stand with Poland & Ukraine! 
Polish PM Donald Tusk reaffirmed support for Ukraine after Trump’s uncouth & vile treatment of President Zelensky. His message was clear: ""Dear Volodymyr Zelensky, dear Ukrainian friends, you are not alone."" 
The fight for freedom unites us all.
#SlavaUkraini #NAFO",0
"You know what kills me as a European ? An Eastern European too ?

Nobody wants shit with Russia: we just want Russia to leave us the fuck alone lmfao — we want the US to leave us the fuck alone too",0
"Who needs a pee tape! Remember Helsinki? And the day when he brought the Russians into the Oval alone & insisted on no notes? You don’t have to be a conspiracy theorist to understand how dark all of this is, how venal & hollow & easy to play he is",0
"Fact: If a service dog approaches you and is alone, it means the owner can't move. If you follow the dog back, you will get a free wallet or handbag.",0
"Why would any country in the world trust the United States right now? They'd all be crazy to stay in any alliance with us, let alone think of forming a new one.",0
"It was obviously premeditated.  The only thing good to come out of it is that Europe now knows that the US is compromised, and they will have to go it alone.",0
"Reading the tweets of EU leaders, odds that Europe continues to go it alone arming and supporting Ukraine - regardless of US policy - surely rising. Wouldn't have said that a week ago",0
"A night alone, thinking about you 
Early access to photos and videos on Patreon ",0
"""used to think the worst thing in life was to end up all alone. It's not. The worst thing in life is ending up with people who make you feel all alone""

- Robin Williams",0
In the office alone this morning. I need an assistant,0
Post run gym selfie. Luckily I was alone in the locker room for this #lockedcock #teamlocked #gaychastity,0
war on the rocks brain was terminal from this post alone,0
"I'm feeling less lonely since joining this platform. 
That alone is worth so much",0
"when you ask your little sister for advice on how to convince your crush to date you, but ""sorry"" apparently isn't enough to make up for killing his entire colony #mkbart #transformers #transformersart #maccadam #rampage #transmutate #beastwars #beastwarsuprising #tfcc",0
"Southern Comfort Food, Episode 13, Part 1 - Apple Tartlets

(TW for hospitals)

An anonymous gift box arrived at the hotel. 

#southerncomfortfoodcomic
#radioapple
#myart",0
Should someone burden their partner with their suicidal thoughts?  #suicide #help,0
Lice aren’t cool. Nobody is here to defend lice. All I’m saying is if I could kill all the lice or have any candy bar I wanted at any time for free that’s not a fair choice cuz I don’t have lice and other people don’t get the candy so I have to look out for myself here and take the candy.,0
"I mean it’s not even about being liked anymore tbh the amount of times I’ve been told to kill myself and just treated poorly, yeah it’s enough to push me over",0
Suicidal thoughts going wild tonight,0
Told my dog I would kill myself if she doesn't stop barking,0
"i deactivated twitter and idk if i'll go back or not.  I might kill myself instead. Or maybe just take a lil nappy. We'll see, the night is young!",0
"Myself, I don't think much about Christians, as long as they are not trying to kill me",0
"The #HazbinHotel community right now is like : ""I've only had Abel for a day and a half, but if anything happened to him, I would kill everyone in this room and then myself.""
And honestly, I'm not disappointed ",0
"Well I've had a lovely week off work. Deciding I can play videogames for myself and not just save them for the channel was the best decision ever, feels great! Maybe I'll even clear my backlog (in a few years )

Here's hoping my first day back doesn't hit me like a truck and kill this mood ",0
this shit goes so hard,0
also had a really gay dream about him last night and woke myself up trying to move to do smth in the dream but rolling over irl and needless to say i'm mad as fuck about that fdhkgdfhgk like i was trying to turn around and stroke his hair.. just kill me already i guess??,0
"TW: Suicide

Apparently the first effect of the antidepressants I'm taking is that you regain motivation, before they start affecting the depression, which might explain why I was so suicidal last weekend. I'm extremely depressed and had suicidal thoughts, and I was motivated to do sth about them.",0
I’d rather fucking kill myself then have to ask a Nazis permission to be an American. Fuck you and fuck that,0
I have only known piss for 10 minutes but if anything ever happens to him I will first kill everybody in this room and then myself.,0
"Great, I educated myself and feel really bad about supporting bigotry and genocide, and want to stop. I would like those who take my tax dollars to kill babies and infants to stop and return my money with interest, and then I will listen to their opinions. Until then, no.

bsky.app/profile/dipl...",0
"#JamesBarryDiary 25/12/1873 Christmas Day at long last, and a calm moderate day it was. Cunningham not here today - taking his Christmas at home. I was attending the mill and kill myself all day. The Orangemen have a Ball at Charles Fraser's tonight. (Nancy Stewart's old stand.)",0
i shoooould probably also draw an icon for myself. one that isint pompy. as much as i love her she looks very 'will kill you' (which is great for her design! but not for talking to people online),0
[Medium Article] I Used the Power of Artificial Intelligence to Create an Exhaustive List of all the Ways I can Kill Myself.,0
"OMG this is insane. But of course, Fascists have disdain for arts,sciences, literature, music, information. I can't stay here. I wanna fight against it but I can't live with it. I'd kill myself before I allow these motherfucking, corrupt, greedy evildoers to have control over my life.",0
I would rather kill myself than bomb a refugee camp. who CARES what might happen to you if you refuse to follow an order to bomb people?! fucking kill yourself if you're bombing a refugee camp because someone told you to. I would fly that plane into the ground with me in it & livestream it. fuck,0
Windshield has a big crack in it. Might kill myself,0
