text,depressive
"if there's one thing i hate about myself,

it's that i fall for someone who i think is cute only after interacting a few times. in the last week & a half, i've been caught daydreaming about two bloomfs  & how i want to make out with them & everytime i see their profile on here, i become aroused ",0
"I've followed his career since 2014 and as much as I hate him now I still know the man's a genius and anyone who thinks that by accident or con you can become the richest man in the world is a fool.
On this he's right, science tells us there's a killer asteroid with our name on it someday somewhere!",0
"I sorta hate that I’ve become That Guy when it comes to karaoke but at least I’m not as obnoxious as that one dude (@therachel.bsky.social knows who I’m talking about—and yes, I’ve seen him around in the last couple years, and he’s still that bad if not worse)",0
"I used to be pretty laissez-faire about it but after hearing stories from my students who work at the local casino, I've become more opposed. A couple of them have said they hate social-security day because they see people they know can't afford to gamble go in and blow lots of money",0
"My X account does not reflect how I've become since my birthday. I came here to feel free from that person. 

Now I don't feel the need to please people who hate everything.",0
Part two!,0
"Im a Trans woman, and I've been a soldier for 18years. The treatment of trans soldiers has become more brazen and prolific since the election. I am appalled that there are Americans who denigrate my service just because I am trans. I'd give my life for my country. Even if it seems to hate me.",0
"And I've started to hate this feeling. Yes, I'm not alone who lives in low conditions. Yes, I'm not alone, who has to work to earn better for myself and my parents. Yes, the happiness is the fleeting feeling and you shouldn't fall into dependency on smt... I feel as I've become worse",0
"I hate who I've become. 
How did this happen to me?
Will this suffering ever end?
Will anything ever be okay?
Can I be fixed?
Or is death my destiny?
Where is my path?
Where do I need to go?
Can I escape this?
I hope that someday...",0
"Its become a meme on jujutsufolk (where every character gets shitty memes and 'hate') and I've seen some people say they use the term bumgumi even when they like him, so I think at least SOME are actual fans, but yeah I really dont get people who dislike him unironically.",0
"when I was in college I had a multimedia teacher who was a dickhead. to introduce himself to the class he showed us his art piece, which was showing us a picture of Bart Simpson. The art was the fact that a static image evoked a voice in our minds. I've become what I hate",0
"#FirstPageFriday
This time a prose excerpt, from my Firefly+Hadestown novel/screenplay project I've been working on since at least April (that was the earliest mention I could find of it). It's the opening narration of a script I've shared before, edited a bit more to serve as an introduction.",0
I hate that this is who I’ve become but I gotta lean in & accept my fate lmao,0
"hate to say it, but I've become one of those people who bring their alice layout split mechanical keyboards to the coffee shop to do work",0
 and since I've been in weekly therapy for a couple years ive become more familiär with the good people who are doing good work in the community but they're doing it with so little. just imagine what could be done if the funds for hate were poured into social services and community initiatives...,0
"It's a truism that power corrupts, but one for the goals here is to really understand why. The standard answer, I think, is just that without constraints people just end up more able and willing to indulge their base instincts. But Magus' story isn't that. For him it's about safety.",0
"See I’m a weirdo who is physically incapable of hiding who I am around people, which leads to a very weird filter when I meet people. Either they get me and we become friends, or they’re weirded out and hate me. I’ve kinda gotten used to it but it still sucks",0
"I’ve got to be nicer to myself when it comes to insecurities. It’s people who gave me those insecurities coming back to haunt me. I’d hate to inadvertently cause somebody else to become insecure because I can’t be open, implying being open is a bad thing.",0
"I just sent a goodbye message to everyone on Meta and it was bittersweet. I'm gonna miss so many people who I've become friends with, but many have reached out to stay connected. Many have even come here. I hate this place so much but I also love it. Fucking America, man.",0
"I've become what I hate, which is a person who actually really appreciates being able to come into office once a week, cuz that bit of socializing in person is actually good for my mental health. smh",0
"TL:DR - I need a break. I'll occasionally be around on Discord, but not too often.

Thanks to everyone who's stuck around for all my music, I promise that when I come back... I won't disappoint.",0
"I've actually become stronger in this AFTER I truely felt the Love of God.

Making people hate themselves and think they did something wrong is fucking insane and is shown by Jesus through things like the lame man, blind man, the one girl who touched his clothes and was healed. 1/2",0
"""We need to expose that account! The interview did that! Stop being so mean to Tay Tay!""

The interview's fallout has become a circlejerk where, BTW, there really isn't much conversation about how and why LOTT and the person behind it are so terrible. 

Here:

www.chayaraichik.net",0
"It's quite a small number of people. I've been told (in way of suggesting I become less introverted) that people who meet me tend to like me quite a bit.

The reason so many people *around you* hate me is not a coincidence. You obviously are drawn to each other by shared pathologies.",0
Beneath the Moon and Me,0
Viz LRT I’ve over the years become intensely distrustful of people who are very big on empathy for a highly-abstracted idea of “people” when they also appear to have a great deal of contempt and/or hate for the actual population of people who occupy that abstract.,0
"Right! Coincidentally, I hate that I've also become a Canadian constitution scold as well in These Times.
My catchphrase is basically ""No, we don't have freedom of speech, actually; we have freedom of expression"" or putting people who say we have a right to bear arms into the bin",0
I’m just saying that your take is one of the few level headed and composed I’ve encountered today. I fought hard against people who hate MAGA inexplicably wanting to become them.,0
I’ve become someone who argues in Facebook groups “the PubMed studies linked on the product page of this $400 health gadget you’re selling do not actually support the claims made in sales copy” and I hate it.,0
"Think about the process required to become a stand-up comedian
I think it's impossible for anyone remotely sane to do that shit ngl
I'm not saying there's no stand-up comedians I like, but the only one's I've seen who are funny AND seem chill also seem to hate their profession",0
"Im.not trying to be a jerk but I've seen these ""hypotheticals"" become reality in cases of former partners going after a woman who had and aided with an abortion. The hospitals have seen such cases too and Alabama is a hostile legislative/judicial environment. I hate all this but understand why.",0
"Actually, Biden gave us Clarence Thomas, didn’t he? If he wants my vote, he must stop the genocide. And those of us who are against the right-winger, Biden, don’t support Trump. We want a better option and a better party. I’ve been a registered Democrat for decades. I hate what my party’s become.",0
"In theory I would bc I absolutely hate housework and I'm not maternal *at all*

HOWEVER I've never known a man who wouldn't eventually (quickly) become resentful of not being the Big Check",0
"It's been two months & I've been living in a cave, did Trump saying this wildly antisemitic shit ever become a big story that Rs had to constantly disavow or did everyone just intentionally forget about it as they pass cynical messaging bills and give insane knesset addresses",0
I've become the kind of person who has strong feelings about how you write a magazine article reference in APA (I hate it so much).,0
I hate who I've become but I got a Christmas sweater for my dog.,0
"I asked my friends if that's ok to bring my mental day art to see what I have been through, and now I feel crap that someone brought up someone who we lost. Even now I hate Twitter has become.

I've already been told to move on but.. At the same time. The guilt is crawling under my skin and- ",0
Ozzy Osbourne's Crazy Train was prescient,0
"These people on bsky are the most hateful, intolerant people I’ve seen across social media. It’s just Twitter before Elon. They really do wish physical harm on everyone who doesn’t conform to their ideology. They HATE everyone on the right, and will become dangerous in the coming months.",0
"Posting on LinkedIn hurts nowadays, because I used to have so many friends there.

It’s on LinkedIn, amongst “like minded professionals” that I first found my voice. 

Now I’m reminded of how radioactive I’ve become . 

I still do it because someone needs to!



www.theage.com.au/national/vic...",0
"//ORT is really is a monster…but if this team setup for each HP won’t do, then I don’t know what will since he’s the most broken character in Type-Moon…is it cause he’s an Archetype? Or a dead Apostle? 

Cause Archetype are powerful & Dead Apostle are scary that Arcueid barely survive killing 1",0
"Man, I hate rap, but if the shoe fits, wear it 
I've become a freak of nature all the kids stare at
Who walk around bumping
RAW, with the shit blaring Saying, ""Fuck school,"" and droppin' out like a miscarriage

open.spotify.com/track/7dDLHl...",0
2025 Anthem?,0
I hate that I’ve become one of those proof who never shut up about their air fryers but it was a game changer for me. Saves time and energy and I can make bacon without making the whole house smell like it.,0
"part of the problem is that the same people who post the ""why do you hate pancakes"" thing one day turn around and become the ""why do you hate pancakes"" people the next day. Zero self awareness. I've stopped taking a lot of people too seriously here",0
"the way i've come to see it is they want bigots to become policy wonks who will see that while dems give public platitudes to minorities, they actually do a ton of quiet policy that makes things worse for them. ""ahhhh, they don't SAY they hate trans, but they do abandon their healthcare! good!""",0
"i hate that I feel like I’ve been searching for what sartre has to say re: consciousness mostly because I disagree with kierke/descartes and even Kant really (was a Hume fan, sorry) on any sort of transcendant ego or self

who should I read after sartre so he doesn’t become my fave?",0
I’ve become the thing I used to hate the most (people who run when there is snow on the ground),0
"As someone who doesn’t have any super speed shipping, I hate that people in big cities expect it when they have far more access to stores containing those things. During this postal strike, I’ve become very aware of people’s unnecessary expectations of service. When I just want service at all.",0
"I know and respect the opinions of folks who hate all this kinda stuff, including change of command ceremonies, challenge coins, etc. etc. Personally I've become more appreciative of milestones and ceremony over time, but I definitely understand why this stuff gives off these vibes to a lot of folks",0
I hate that I've allowed myself to become chained by those who seek to tear me down. The last months haven't been easy. Trying to figure out who I'm supposed to be when I already know who I am. My heart needs to be free.,0
"Even though I predicted her reasoning was gonna be something along the lines of ""Because I want to"" I think it's interesting how they took it in a direction of Johanna wanting to make her life and legend her own and filled with actual memories instead of fictional ones her writing is so cool #FGO",0
"I'm living in Canada right now.  I lived in the US for years.
The hate for the President is palpable here.  It has united Canadians not again the people but against a cruel and evil government and an insane President.",0
i know many of you feel lonely and i wanted to offer encouragement by letting you know that you're really not. I'm living right up here in your attic,0
"me: i plan on living until i'm 120

therapist: how?

me: by not dying.

therapist: okay sure but how?

me: by refusing to die.

therapist: you might need a more comprehensive plan than that.

me: naw i'll just refuse to die.",0
"“The danger/ of memory is going/ to it for respite…Maybe it felt better then, but you were/ not better. You were smaller, as the rain/ gauge must fill to the brim/ with its full portion of suffering./ What can memory be in these terrible times?/ 
Only instruction. Not a dwelling.”",0
"We as a people are very, very spoiled. I’m not saying that in judgment, as I include myself. It’s the natural byproduct of living the type of society we do. But yeah, we’re in for a rude awakening one way or another.",0
"Do it because that experience has scarred me in ways I'm still figuring out and I don't want other folks going through that.  

light up phones.  Make RFK's life a living fucking hell.  Do not let them rest.  The point is to exhaust us.  So I advise exhausting them.",0
when i have a salad for breakfast it’s bc i’m incredibly health conscious and i’m dedicated to clean living. it is NOT because it comes in a big bag and i’m lazy,0
"So I'm here in Colorado
Peace does not run short
Living the freedom that I was made for
Yes I am unfinished
Yes I am not done
Still it's up here in the mountains
I defined my home

Colorado by Chappy

Photo from where I grew up. Although I live in different mountains now this verse still resonates.",0
"Land Back does not mean massacring and violently displacing everyone living on the land. It does not mean stripping people of their rights, proper care, and treatment. YOU think that way because you view everything with a colonial lens. Land Back and Indigenous people are not ""deeply unserious""",0
Regarding no tax on tips; I'm in favor of the waitress at the diner not having to pay tax on the $.50 tip she gets for serving your coffee.  (You cheap bastard)  I'm not in favor of the hedge fund trader declaring his profits as tips and living tax free off you.,0
"One of the all-time great boss moves - “not only am I not gonna look like your weird, bald super villain, but I’m gonna make it so that you’ll never think of another Lex Luthor as living up to what I’m about to do”",0
"It’s our job to make the cost of living as affordable as possible for families in our communities.

Trump’s Tax on Working Families is making people's lives harder, not easier. This isn't how the federal government is supposed to work, and I’m not afraid to call that out.",0
"As a German living in , I'm still shocked (but sadly not surprised) by yesterday's election results. I'm trying to soothe my nerves with a little rainbow crochet - v-stitch makes everything better, right?
#crochet ",0
"Are you doomscrolling? Stop for a moment and eat something -wonderful-. And I'm not saying this because I'm a witch living in a gingerbread house who has discovered the many benefits of social media. Really. Food is a balm for the heart. Stop, slow down, and savour something. ",0
"Imagining these two parading around as holy men has been living rent free in my head recently, the original idea was pitched by @gosskett.bsky.social and I'm loving it, definitely gonna have more of these two committing all sorts of debauchery. Also the first actual nsfw pieces featuring Vassago",0
"The UK class system is very interesting to experience as a foreigner. And I’m not just talking about how entrenched the class system is here; foreigners are seen as ‘outside’ the class system, but they also *must* be hardworking and contributing members of society to justify living here.",0
"I'm going to go out there and say it - analysing income and spending by itself is meaningless unless you also look at outcomes.

Eg to understand the spend on housing, if you don't understand how people are living (alone, with roommates, % at home with parents not included) the stat is meaningless",0
Madonna Beste.,0
My mom just sent a bunch of photos of me in my fursona to our super conservative family. They wanted to know what I do for a living. I’m super proud of my mom for not censoring herself or me despite that being  her Christian upbringing.,0
"I thought this country was built by
Europeans, escaping living under the rule of a King, to establish a New World governed by the people. 
Currently we have a president who calls Himself. 
Our King
If this is a joke,
I'm not laughing",0
72. Ed's POV,0
"Some more studio fun. I’m not a huge fan of studio shoots, I do that for a living every day. But sometimes it’s fun to just play!",0
Feeling... rough. Lately.,0
"Hello Bluesky! I'm Sarah, originally born in Ishgard like many others, but living in Ul'dah these days. I manage the books for mercenaries and a few caravans. Ever need my services, get hold of me, if not then hopefully you enjoy my day to day life in photos. 

See ya around darlin', xoxo",0
It’s hard to parse the fact that he’s a nice guy who happens believe that most of his coworkers should die & burn in hell for all eternity. I’m not even “allowed” to swear around him…I test software for a living! Swearing is inevitable!,0
"I have no idea what happened. I’ve lost weight, my diet is controlled, I don’t drink, and I’m not on any funky meds.

Looking forward to living it up with my wife and our friends.",0
,0
"Listen, I don't care. I'm tired of living in a world that is too afraid to speak real words. I'm tired of holding back my voice, and I'm damn tired of this FUCKING WORLD censoring everything. LIFE EXISTS. Trans people exist! Woman, you EXIST, you are not property despite how hard America is trying.",0
I'm not sure this could have been written if I were living in Cyprus...,0
"Here's something I wrote (and recently re-wrote) that I like to share around Academy Awards Time:

The Kids Are Not Alright: The 2019 Academy Award Live Action Short Films Made Me Want To Die

Link below but I'll also thread here with alt text if that would please ya

medium.com/@ryansimmons...",0
"I should mention that the living room shares a wall with the bedroom, so my head was probably about a foot away from whatever was picking up the music. This is also at the center of the house and can’t be heard anywhere else so it’s not just a loud neighbor. I’m grateful that they have good taste.",0
I’ve been saying I have Trump induced PTSD for YEARS. I think he should pay for therapy sessions. I’m NOT being facetious. I blame his previous administration for my extreme anxiety. It’s also adversely affected my asthma. I honestly never despised any living person until Trump. He’s EVIL ,0
"Maybe I’m not living on Planet Reality, but shouldn’t the US president have more pressing things to do than bribe his way to chairing arts boards? Glad I’ve already experienced the Kennedy Center because I’m sure as hell never going back - especially when it is renamed.",0
"I’m caught between paying keen attention or just living under a rock for four years. It’s not just the ridiculousness of it all, but the danger it creates. JFC",0
,0
"Senator Schumer, I'm a former New York City resident and have family members living in NY. You had a good run. It's time to step aside and let new leadership take your place. This is not the time for ""bipartisanship"". Democrats need courageous leaders who are willing to stand up for the rule of law.",0
"Now it's saying ""That was for you, not for everyone!"" 

Dude, i take notes for a living. If you're gonna wake me up to say a weird thing I'm writing it down.",0
Living vegan? Sign me up! *I'm totally not biased*,0
Living ten feet from the beach was not my plan but I'm glad it's happening,0
"I've been reckless, I let my caution slip. And now I'm sick and I might have transmitted it to others (though I'm now masking on public transport and indoors in public spaces again).

We're still living through this. It's not over.",0
"I’m not aware of any instances of direct translation of DNA to protein in living organisms.

Does this happen? Can someone send me a paper on it?",0
I’m sorry that is happening. I used to think that we living in a more friendly state but not so!,0
"Lisbeth + Alistair

Someone ask for sappy love songs? Look no further  

#DABlorbos #OCShip #LisbethAeducan #DragonAge #DAO #AlistairTheirin

bsky.app/profile/abig...",0
"I thought living through middle school drama was the worst but actually it’s not; PARENTING someone going through middle school drama is actually the WORST. 

I’m extremely over the whole thing.",0
I always did think that Jareth was a cat...,0
The problem is this house is so LOUD (not just the people but everything CREAKS and there are all these bells????) and it's so hard to get to sleep. I'm used to living in silence like a cloistered nun.,0
"Praying next year I can Not live with my parents
I'm probs gonna be living in the dorms at the university I'm gonna transfer to but like maaaaaan",0
"This weekend is mine. 
I'm not wearing clothes until Monday. I will play porn all weekend in my living room and bedroom. If you are reading this I'm probably naked. Masturbating, Sleep. Or doing something related to porn 
THIS IS MY WEEKEND TO WORSHIP PORNOGRAPHY",0
"THANK YOU.

Signed,  25+ year chronic illness and pain sufferer for whom at this point in life the worst part about it genuinely is people being assholes to me bc I'm not a smiley bubbly good little woman while also trying to be a decent and functional human being living life on challenge mode.",0
i’m not too sure that journalist dude knows i’m living on top of the news station yet,0
I feel so alone and empty inside,0
Granted I’m in the position of not living in the USA but we’re all on the same planet,0
"if you see this, post 4 fighting game mains.

I'm not that great at fighting games, because I usually fight the controls, and I don't put that much time into them. That's why I usually gravitate towards zoners.

Characters:
RoA Sylvanos | GGST Slayer
GGST Testament | FS Argagarg",0
"On this first Sunday of Advent, I'm praying for and with people living in the land of deep darkness, longing for a future in the midst of despair. And it's not just for Christian families.
www.reuters.com/world/middle...",0
"An expedited or longer last visa. I told my wife, once they try to implement Trump bibles into school curriculum, we're out of here. I'm not letting my kids get indoctrinated in this white cult bullshit. I don't like living in this country enough",0
"The war is not over. russians occupied 30% in 2022. They lost territory and now grind 0.5% a year. I’m a Ukrainian living in 20km distance from the russian border under regular bombings, by the way. Weird how a foreigner miles away tries to portray our situation worse than even actual Ukrainians.",0
I'm livid..I'm so sorry...I'm not at all ecstatic of the next 4 years under this criminals presidency...but we will be living..we will fight..I'm not going to give. & neither should you..I will live so be it.,0
I’ve already given up alcohol and donuts. But if I had to give up pizza too then I’m not sure life would still be worth living.,0
"Ah fuck. Yes. I have been living on my pot of greens and rice. Meat 1-2 days a week. I think so many of us are in the same boat, having taken in family, cutting the budget, sharing cars and food. It’s bad, and the leaders are just not cutting it. I’m telling ya, we need militias in our streets.",0
"It’s not even funny anymore. This is no joke. Every day, the (trump nominee) news gets worse and worse. I’m sad, I’m disgusted, and more than disappointed, that I’ve seen no one that I voted for, trying to stop this horror we’re living in right now…. And the hell we WILL be living in.",0
"This is the thanks I get for animated a sock into a living person.
I get pulled into a sleeping bear hug and then get fucked the shit out of.

What do you mean? Of course I'm not complaining",0
"I'm not a US ctzen, nor living in US. Makes me sick what Trump brought to our world. But Dems are way too quiet, it comes through as indecision or even lack of will.And when some Dem representatives are voting w him in the House and Senate week in and week out w/out consequence,it doesn't look good,",0
"Do you ever just look at the people around you and want to scream, “WTF WORLD ARE YOU LIVING IN?!?” just to try to snap them into reality again?

Not just one or two people. I’m talking ALL of society.",0
"I’m afraid not, I’m from the Chicago area living in the the Bay area now.",0
"""Imagine all the people living life in peace. You may say I'm a dreamer, but I'm not the only one. I hope someday you'll join us, and the world will be as one.""

-- John Lennon, who died #OTD 1980",0
"I’m so excited by how well this costume has come together. I need 1-2 very small things and it is ready to go.

I’m not saying I’m living my cosplay dream, but…",0
"we are living in insane-o-vision 24/7 sometimes, sometimes I shut off everything and just see a bunny rabbit and I'm good. I just have to balance out the madness with some peace, not pay attention to it. kind of hilarious at times.",0
